{
  "schema_version": "eos_nvt_project_create_command.v1",
  "tenant_id": "tenant-demo",
  "business_operation_id": "a1000000-0000-4000-8000-000000000001",
  "idempotency_key": "demo-nvt-project-create-1",
  "payload_hash": "sha256:aaaaaaaaaaaaaaaaaaaaaaaaaaaaaaaaaaaaaaaaaaaaaaaaaaaaaaaaaaaaaaaa",
  "requester_subject_id": "employee-1001",
  "requested_operation": "PROJECT.NVT_PROJECT.CREATE",
  "nvt_project": {
    "nvt_project_id": "a2000000-0000-4000-8000-000000000001",
    "nvt_project_code": "NVT-DEMO",
    "name": "NVT Demo",
    "status": "ACTIVE"
  }
}
